{
  "$schema": "https://json-schema.org/draft/2020-12/schema",
  "$id": "urn:ribbon:manifest:v2",
  "title": "Ribbon project manifest",
  "type": "object",
  "required": ["manifestVersion", "name", "slug", "framework", "providers", "urls", "status"],
  "properties": {
    "$schema": { "type": "string" },
    "manifestVersion": { "const": 2 },
    "name": { "type": "string", "minLength": 1 },
    "slug": { "type": "string", "pattern": "^[a-z0-9]+(?:-[a-z0-9]+)*$" },
    "description": { "type": "string" },
    "framework": { "const": "vite-react" },
    "projectType": { "enum": ["application", "control-plane"], "default": "application" },
    "providers": {
      "type": "object",
      "required": ["deployment", "backend", "designSystem"],
      "properties": {
        "deployment": {
          "oneOf": [
            {
              "type": "object",
              "required": ["provider"],
              "properties": {
                "provider": { "const": "vercel" },
                "projectId": { "type": "string", "minLength": 1 },
                "projectName": { "type": "string", "minLength": 1 },
                "teamId": { "type": "string", "minLength": 1 },
                "teamSlug": { "type": "string", "minLength": 1 },
                "cnameTarget": { "type": "string", "default": "cname.vercel-dns.com" }
              }
            },
            {
              "type": "object",
              "required": ["provider"],
              "properties": {
                "provider": { "const": "netlify" },
                "siteId": { "type": "string", "minLength": 1 },
                "siteName": { "type": "string", "minLength": 1 },
                "accountSlug": { "type": "string", "minLength": 1 },
                "cnameTarget": { "type": "string", "minLength": 1 }
              }
            }
          ]
        },
        "backend": {
          "oneOf": [
            {
              "type": "object",
              "required": ["provider"],
              "properties": {
                "provider": { "const": "supabase" },
                "projectRef": { "type": "string", "minLength": 1 },
                "organizationSlug": { "type": "string", "minLength": 1 },
                "region": { "type": "string", "minLength": 1 }
              }
            },
            {
              "type": "object",
              "required": ["provider"],
              "properties": {
                "provider": { "const": "firebase" },
                "projectId": { "type": "string", "minLength": 1 },
                "projectName": { "type": "string", "minLength": 1 },
                "region": { "type": "string", "minLength": 1 }
              }
            }
          ]
        },
        "dns": {
          "oneOf": [
            {
              "type": "object",
              "required": ["provider", "domain", "hostname"],
              "properties": {
                "provider": { "const": "hostinger" },
                "domain": { "type": "string", "minLength": 1 },
                "hostname": { "type": "string", "minLength": 1 },
                "ttl": { "type": "integer", "minimum": 300, "maximum": 86400, "default": 300 }
              }
            },
            {
              "type": "object",
              "required": ["provider", "proxied"],
              "properties": {
                "provider": { "const": "cloudflare" },
                "zoneId": { "type": "string", "minLength": 1 },
                "domain": { "type": "string", "minLength": 1 },
                "hostname": { "type": "string", "minLength": 1 },
                "ttl": { "type": "integer", "minimum": 60, "maximum": 86400, "default": 300 },
                "proxied": { "const": false }
              }
            }
          ]
        },
        "mail": {
          "oneOf": [
            {
              "type": "object",
              "required": ["provider", "apiTokenEnv", "mailboxIdEnv", "fromEnv"],
              "properties": {
                "provider": { "const": "hostinger-mail" },
                "apiTokenEnv": { "const": "HOSTINGER_MAIL_API_TOKEN" },
                "mailboxIdEnv": { "const": "HOSTINGER_MAILBOX_ID" },
                "fromEnv": { "const": "HOSTINGER_MAIL_FROM" }
              }
            },
            {
              "type": "object",
              "required": ["provider"],
              "properties": { "provider": { "const": "backend" } }
            }
          ]
        },
        "designSystem": {
          "type": "object",
          "required": ["provider", "source", "version", "packages", "requiredComponents"],
          "properties": {
            "provider": { "const": "strawn" },
            "source": { "const": "npm" },
            "version": { "const": "0.1.0" },
            "packages": {
              "type": "array",
              "prefixItems": [
                { "const": "strawn" },
                { "const": "strawn-icons" }
              ],
              "minItems": 2,
              "maxItems": 2
            },
            "requiredComponents": {
              "type": "array",
              "allOf": [
                { "contains": { "const": "ThemeProvider" }, "minContains": 1 },
                { "contains": { "const": "TooltipProvider" }, "minContains": 1 }
              ]
            }
          }
        }
      }
    },
    "urls": { "type": "object" },
    "status": { "enum": ["draft", "local", "preview", "production", "archived"] }
  },
  "allOf": [
    {
      "if": {
        "properties": { "projectType": { "const": "control-plane" } },
        "required": ["projectType"]
      },
      "then": { "properties": { "slug": { "const": "ribbon" } } }
    }
  ]
}
